운동명,운동 정보,운동 소개,운동 절차,운동 팁,썸네일 링크,유튜브 링크
Hanging Knee Raise,"{""targetMuscleGroup"":""Abs"",""exerciseType"":""Strength"",""equipmentRequired"":""Bodyweight"",""mechanics"":""Compound"",""forceType"":""Pull"",""experienceLevel"":""Intermediate"",""secondaryMuscles"":""Forearms ""}",,"The hanging knee raise hits your lower abs You can hang from literally anything to do this exercise, but the most popular method using hanging from a pull up bar Grip the bar with hands around shoulder width apart Increase the width if you're tall and your feet touch the floor Once you're hanging with your feet slightly off the floor, slowly pull your knees up keeping your legs together Pause for a second, and slowly lower your knees back to the starting position Repeat for desired reps Knee Raise ","You must do this exercise slowly  If you want to get the most benefit out of the hanging knee raise, slow it down As you become more advanced, you can place a dumbbell between your feet Avoid swinging your body, keeping your torso as still as possible  ",https://cdn.muscleandstrength.com/sites/default/files/styles/400x250/public/field/image/exercise/hangingkneeraise1.jpg?itok=AllhG8ki,
Standing Stomach Vacuum,"{""targetMuscleGroup"":""Abs"",""exerciseType"":""Strength"",""equipmentRequired"":""Bodyweight"",""mechanics"":""Isolation"",""forceType"":""Pull (Bilateral)"",""experienceLevel"":""Intermediate"",""secondaryMuscles"":""None ""}","The standing stomach vacuum is a bodyweight core exercise that can be done from anywhere.
It is a standing variation of the plank that is used to isolate the abdominal muscles for a focused contraction.
","In a standing position, place your hands overhead or on your sides and exhale all of the air from your lungs Once you’ve completely exhaled, think about trying to draw your belly button to your spine Hold for the desired amount of time and then repeat for assigned number of repetitions ","Exhale hard like you’re blowing out candles on a cake and hold the contraction for a second in order to improve mind muscle connection ",https://cdn.muscleandstrength.com/sites/default/files/standing-stomach-vacuum.jpg,https://www.youtube.com/embed/ODOHve6b8q8?rel=0
Lying Floor Knee Tuck,"{""targetMuscleGroup"":""Abs"",""exerciseType"":""Strength"",""equipmentRequired"":""Bodyweight"",""mechanics"":""Compound"",""forceType"":""Pull (Bilateral)"",""experienceLevel"":""Beginner"",""secondaryMuscles"":""None ""}","The lying floor knee tuck is a variation of the abdominal crunch and an exercise used to isolate the muscles of the abdomen.
The lying floor knee tuck is a flexion based exercise which keeps the lower abdominal muscles under constant tension during the entire range of motion.
","Lay supine in a relaxed position with your legs straight and your hands underneath your low back for support Raise the knees toward your forehead while contracting your abdominals and exhaling Once your abs are fully contracted and your knees are slightly above parallel, slowly lower your legs back to the starting position Complete for the assigned number of repetitions ","Exhale hard like you’re blowing out candles on a cake and hold the contraction for a second in order to improve mind muscle connection If your lower back bothers you during this exercise, choose more anti extension and anti rotation based movements Avoid putting the hands behind the head as this can lead to excess strain upon the neck ",https://cdn.muscleandstrength.com/sites/default/files/lying-floor-knee-tuck.jpg,https://www.youtube.com/embed/V95h0UX8UyI?rel=0
Alternate Straight Leg Lower,"{""targetMuscleGroup"":""Abs"",""exerciseType"":""Strength"",""equipmentRequired"":""Bodyweight"",""mechanics"":""Compound"",""forceType"":""Isometric"",""experienceLevel"":""Beginner"",""secondaryMuscles"":""None ""}","The alternating straight leg lower is an exercise used to strengthen the muscles of the abs.
The alternating straight leg lower utilizing a slow eccentric to place tension on the core as you fight to stabilize your body during the range of motion.
It is an anti-extension based ab exercise.
","Setup in a supine position with your legs straight, hips flexed, and arms by your sides Slowly lower one leg as you exhale and maintain the position of hip flexion on the other side Return back to the starting position and repeat on the opposite side Repeat for the desired number of total repetitions ","Do not hold your breath, you shouldn’t be using respiration to compensate for a lack of stability  Learn how to move while maintaining position without having to rely upon your breath Use your breath to drive abdominal activation, exhale as you lower the leg Move slowly but methodically  The goal is control within space, not simply completion of repetitions The heel doesn’t have to touch the floor  In fact, in most cases it will actually generate compensations if someone is missing end range hip extension If you find that you can’t keep the position of hip flexion on the non working leg, then wrap a band around your foot and pull down gently on the band with your hands  This will help to enhance motor control during the completion of repetitions ",https://cdn.muscleandstrength.com/sites/default/files/alternate-straight-leg-lower.jpg,https://www.youtube.com/embed/eiF6KbbXfb8?rel=0
Bench Jack Knife,"{""targetMuscleGroup"":""Abs"",""exerciseType"":""Strength"",""equipmentRequired"":""Bodyweight"",""mechanics"":""Compound"",""forceType"":""N/A"",""experienceLevel"":""Beginner"",""secondaryMuscles"":""None ""}",,"Lay down on your back on a flat bench with your legs hanging off one end Extend your arms out above your head, and straighten your legs You should be laying completely flat This is the start of the exercise In one motion, while keeping your hands and feet together, raise your legs and bring your arms forward as if you were trying to touch them together Lower back to the starting position Repeat for desired reps Jackknife ","This is a very challenging exercise  The slower you do it the harder it is, and the more benefit you will get from it  Your legs should be approximately 35-45 degrees from the floor Your arms should be extended and parallel to your legs at the top of the movement  ",https://cdn.muscleandstrength.com/sites/default/files/styles/400x250/public/field/image/exercise/benchjackknife1.jpg?itok=17tQRupd,
Plank to Hip Raise,"{""targetMuscleGroup"":""Abs"",""exerciseType"":""Strength"",""equipmentRequired"":""Bodyweight"",""mechanics"":""Compound"",""forceType"":""Isometric"",""experienceLevel"":""Beginner"",""secondaryMuscles"":""None ""}","The plank to hip raise is a variation of the plank exercise and an exercise used to strengthen the abdominal muscles.
The plank to hip raise works the abs through a few different force types. The first is obviously through isometrics while performing the plank.
Then, it shifts to a pull movement as you contract the abs to pike your hips.
","Assume a kneeling position with your elbows resting slightly above your head on the floor Extend each leg and maintain a hip width stance Push your elbows into the floor and pike your hips Lower your hips back to the starting position and repeat for the desired number of repetitions ","Move slowly but methodically  The goal is control within space, not simply completion of repetitions If you struggle to get your arms overhead and your hips piked then examine your thoracic extension and look to improve it via soft tissues strategies found on the site Press your elbows into the floor to help engage your serratus anterior  Your upper back should be filled out and there shouldn’t be an indention between your shoulder blades Do not hold your breath, you shouldn’t be using respiration to compensate for a lack of stability  Learn how to move while maintaining position without having to rely upon your breath ",https://cdn.muscleandstrength.com/sites/default/files/plank-to-hip-raise.jpg,https://www.youtube.com/embed/9Wd3xH6-QYw?rel=0
Pallof Press,"{""targetMuscleGroup"":""Abs"",""exerciseType"":""Strength"",""equipmentRequired"":""Cable"",""mechanics"":""Compound"",""forceType"":""Isometric"",""experienceLevel"":""Beginner"",""secondaryMuscles"":""None ""}","The Pallof press is an exercise commonly used to strengthen the muscles of the abs and obliques.
It works the core by providing isometric tension while you move a weight through a brief range of motion.
It’s an extremely versatile exercises which has had many variations stem from it to challenge the core in many different ways and to help accomplish different goals.
If you have a goal of increasing core strength, the pallof press should be a staple in your core workouts.
","Assume a standing position and attach a handle to a cable stack at chest height Hold the handle to your chest and assume an athletic base position with your feet slightly wider than shoulder width apart Press the handle horizontally to extension as you exhale Return to the starting position and repeat for the desired number of repetitions on both sides ","Don’t allow the hips to rotate as you press the handle to extension Ensure that you exhale as you press to use the breath to drive more abdominal activation If you find you can’t maintain a neutral spinal position during this variation, regress to a supine version and then progress into a half kneeling and tall kneeling version once you gain the requisite lumbo-pelvic control Do not hold your breath, you shouldn’t be using respiration to compensate for a lack of stability  Learn how to move while maintaining position without having to rely upon your breath ",https://cdn.muscleandstrength.com/sites/default/files/pallof-press.jpg,https://www.youtube.com/embed/SFJprbDnaS0?rel=0
Straight Leg Toe Touch (Floor Toe Reach),"{""targetMuscleGroup"":""Abs"",""exerciseType"":""Strength"",""equipmentRequired"":""Bodyweight"",""mechanics"":""Isolation"",""forceType"":""Pull (Bilateral)"",""experienceLevel"":""Beginner"",""secondaryMuscles"":""None ""}","The straight leg toe touch is a variation of the abdominal crunch and an exercise used to isolate the muscles of the abdomen.
The straight leg toe touch keeps constant tension on the lower abs as you go through flexion with the top portion of your abs.
","Lay supine in a relaxed position with your arms and legs straight Raise your legs straight until they are perpendicular with the floor Exhale as you reach straight up towards your toes Once your abs are fully contracted and your upper back is off the floor, slowly lower yourself back to the starting position Complete for the assigned number of repetitions ","Exhale hard like you’re blowing out candles on a cake and hold the contraction for a second in order to improve mind muscle connection If your lower back bothers you during this exercise, choose more anti extension and anti rotation based movements Avoid putting the hands behind the head as this can lead to excess strain upon the neck ",https://cdn.muscleandstrength.com/sites/default/files/straight-leg-toe-touch-1.jpg,https://www.youtube.com/embed/yjfLpiFyGxs?rel=0
Lying Bench Leg Raise,"{""targetMuscleGroup"":""Abs"",""exerciseType"":""Strength"",""equipmentRequired"":""Bodyweight"",""mechanics"":""Isolation"",""forceType"":""N/A"",""experienceLevel"":""Beginner"",""secondaryMuscles"":""None ""}",,"The lying bench leg raise hits your lower abdominal muscles Set up for the exercise by getting a flat bench and positioning it to give enough room for your legs to extend out over one end Sit on the bench with your buttocks close to one end and lay back Grasp the bench at head height for stability Extend your legs straight out level with your body, keeping your knees and feet together This is the starting position for the movement Bending at the hips only, slowly raise your legs up until they are pointing straight up Do not pause, and immediately slowly lower your legs back to the starting position Repeat for desired reps ​Leg Raise ","Do not swing your legs  Use your abs to move your legs and not momentum Keep your legs and knees together, and don't let your feet drop below the height of the bench ",https://cdn.muscleandstrength.com/sites/default/files/styles/400x250/public/field/image/exercise/lyingbenchlegraise1.jpg?itok=4qcDfnqD,
Dead Bug,"{""targetMuscleGroup"":""Abs"",""exerciseType"":""Strength"",""equipmentRequired"":""Bodyweight"",""mechanics"":""Compound"",""forceType"":""Isometric"",""experienceLevel"":""Intermediate"",""secondaryMuscles"":""None ""}","The deadbug is an exercise used to strengthen the muscles of the abs. The exercise stems from the plank exercise family tree.
The deadbug works as an anti-extension abdominal exercise in which you must keep the spine stable as you slowly raise your arm overhead.
The deadbug gets its name because you look like a dead bug on its back with its legs in the air when you are performing the exercise.
","Setup in a supine position with your legs in a 90/90 position (90 degree bend at the hips and knees) and your arms reaching towards the ceiling Extend the opposite arm and leg simultaneously as you exhale Return back to the starting position and repeat on the opposite side Repeat for the desired number of total repetitions ","Do not hold your breath, you shouldn’t be using respiration to compensate for a lack of stability  Learn how to move while maintaining position without having to rely upon your breath Move slowly but methodically  The goal is control within space, not simply completion of repetitions Ensure that you exhale as the arm moves overhead and the leg extends  The goal is to keep the ribs down and prevent the lower back from hyperextending If you can’t maintain a neutral spine while moving the arm and leg simultaneously, then begin with just the arms or legs by themselves  Only incorporate more elements when you’ve mastered control of the individual components ",https://cdn.muscleandstrength.com/sites/default/files/deadbug.jpg,https://www.youtube.com/embed/eEhoSeBFoBk?rel=0
Decline Abdominal Reach,"{""targetMuscleGroup"":""Abs"",""exerciseType"":""Strength"",""equipmentRequired"":""Bodyweight"",""mechanics"":""Compound"",""forceType"":""N/A"",""experienceLevel"":""Beginner"",""secondaryMuscles"":""None ""}",,"Set a decline bench at a height of between 30 and 45 degrees  The higher you set the bench the more challenging the exercise will be Position yourself on the bench with your head at the lowest end Get into the starting position by putting your hands together pointing at the ceiling and raising your shoulder blades slightly off the bench Keeping your hands together, reach straight up towards the ceiling as far as possible Pause, then lower yourself back to the starting position (with your shoulder blades off the bench) Exercise ","This exercise is awesome for core strength It's already challenging, but you can add extra intensity by holding a dumbbell in your hands and pausing for a count of 2 at the top of the exercise Make sure you don't let your shoulder blades touch the bench throughout the set ",https://cdn.muscleandstrength.com/sites/default/files/styles/400x250/public/field/image/exercise/declineabdominalreach1.jpg?itok=4rXJEzBe,
Chair Leg Raise,"{""targetMuscleGroup"":""Abs"",""exerciseType"":""Strength"",""equipmentRequired"":""Bodyweight"",""mechanics"":""Isolation"",""forceType"":""N/A"",""experienceLevel"":""Intermediate"",""secondaryMuscles"":""None ""}",,"The Roman Chair leg raise hits your lower abs Set up for the exercise by positioning yourself in the Roman chair Your forearms should be along the horizontal pads, hands gripping the handles, and back against the back pad Take your feet off the supports so they're hanging This is the start position of the exercise Keeping your legs straight, feet and knees together, raise your legs up as far as possible Pause for a count of 1 or more, then lower back to the starting position Repeat for desired reps ​Leg Raise ","The longer you hold your legs up on each rep the harder the abs work Increase the hold to make the exercise harder ",https://cdn.muscleandstrength.com/sites/default/files/styles/400x250/public/field/image/exercise/chairlegraise1.jpg?itok=6rWNzdfB,
Lying Alternate Floor Leg Raise,"{""targetMuscleGroup"":""Abs"",""exerciseType"":""Strength"",""equipmentRequired"":""Bodyweight"",""mechanics"":""Isolation"",""forceType"":""N/A"",""experienceLevel"":""Beginner"",""secondaryMuscles"":""None ""}",,"Set up for the lying floor leg raise by putting a mat on the floor and laying down on your back with your legs extended straight out and your arms by your side with palms on the floor Get ready to start the set by lifting your heels off the floor slightly Keeping your right leg straight out in front of you off the floor, raise your left leg slowly up to 90 degrees Slowly lower your left leg back to the starting position without touching the floor and repeat the movement with your right leg ​Leg Raise ","Keep your feet off the floor for the entire set Do not pause at the top of the movement Keep movements slow and steady ",https://cdn.muscleandstrength.com/sites/default/files/styles/400x250/public/field/image/exercise/lyingalternatelegraise1.jpg?itok=zhHDRtAv,
Turkish Get Up,"{""targetMuscleGroup"":""Abs"",""exerciseType"":""Strength"",""equipmentRequired"":""Kettle Bells"",""mechanics"":""Compound"",""forceType"":""Push (Bilateral)"",""experienceLevel"":""Beginner"",""secondaryMuscles"":""Adductors, Glutes, Hamstrings, Quads, Shoulders, Upper Back ""}","The Turkish get up is a full body movement that challenges the muscles of the core to stabilize the spine as you go from a side lying position to a standing position all while maintaining a weight overhead.
The Turkish get up can be incorporated into any kind of program, but is best used as a corrective and/or warm up exercise.
","Setup in a side lying position with the kettle bell in a front racked position and your hands overlapped on the handle Roll onto your back and press the kettle bell to extension with one hand Extend your free hand to the side and raise the knee on the same side as the kettle bell (i e if you’re holding the weight in your R hand, your R knee should be flexed)Sit up to the elbow as you punch the kettlebell overhead Extent the elbow you’re braced on and push yourself up to your hand Bridge the hips up while keeping one leg straight Once the hips are extended, sweep the straight leg through and assume a half kneeling position with one hand still on the floor and the other overhead Bring the torso upright, reposition the down leg so that it’s inline with the forward leg, and then drive up to a standing position out of the half kneeling stance From the standing position, simply step back in a reverse lunge to revert to the half kneeling position Repeat steps #1-8 in reverse order to get back to the supine starting position Repeat for the desired number of repetitions ","You should be looking at the kettlebell for the ENTIRE duration of the exercise  As you become more experienced, you may be able to look straight ahead once you get to the half kneeling stance but initially it’s wise to just focus solely on the weight overhead Don’t start with heavy weight (or any weight at all if just learning the get up), use a shoe, a ball, or something else with a relatively light weight For the initial sit-up portion of the lift, use the cue from Dan John, “Punch and crunch!”The turkish get up is mainly used a corrective exercise or warm up drill  It can be used in more general population settings Focus on squeezing the handle of the kettlebell tightly in order to improve stability at the shoulder ",https://cdn.muscleandstrength.com/sites/default/files/turkish-get-up.jpg,https://www.youtube.com/embed/kYxmLkgnfD8?rel=0
Abominal Hip Thrust,"{""targetMuscleGroup"":""Abs"",""exerciseType"":""Strength"",""equipmentRequired"":""Bodyweight"",""mechanics"":""Isolation"",""forceType"":""N/A"",""experienceLevel"":""Beginner"",""secondaryMuscles"":""None ""}",,"Grab a flat bench and lay down on your back with your feet hanging off one end Grasp the bench above your head Keeping your feet and knees together, bring your legs up until they're pointing straight up towards the ceiling This is the start of the exercise Thrust your hips up off the bench by lifting your buttocks up Slowly lower back down Repeat for desired reps ​Hip Thrust ","Pause at the top of the movement for added intensity ",https://cdn.muscleandstrength.com/sites/default/files/styles/400x250/public/field/image/exercise/hipthrusts1.jpg?itok=j0DgNgw0,
Decline Weighted Twist,"{""targetMuscleGroup"":""Abs"",""exerciseType"":""Strength"",""equipmentRequired"":""Other"",""mechanics"":""Isolation"",""forceType"":""N/A"",""experienceLevel"":""Intermediate"",""secondaryMuscles"":""Lower Back, Shoulders ""}",,"Get a decline bench and set the angle at around 30 to 45 degrees Select the weight you wish to use  We recommend using a weight plate but you can also use a medicine ball or dumbbell Sit on the bench with your feet up the high end resting through the pads Keeping your back straight, lean back until your back it at right angles to the bench (90 degrees) Holding the weight out in from of you with your arms slightly bent, twist at the mid section bringing the weight over to your right side Do not pause, and slowly move the weight back across to your left side Repeat for desired reps ​Exercise ","Do not swing the weight back and forth  Use your mid section to control the weight ",https://cdn.muscleandstrength.com/sites/default/files/styles/400x250/public/field/image/exercise/declineweightedtwists1.jpg?itok=XW5619n0,
Standing Oblique Cable Crunch,"{""targetMuscleGroup"":""Abs"",""exerciseType"":""Strength"",""equipmentRequired"":""Cable"",""mechanics"":""Isolation"",""forceType"":""Pull"",""experienceLevel"":""Beginner"",""secondaryMuscles"":""None ""}",,"The standing oblique cable crunch hits the abs and obliques Set up the high pulley cable machine by attaching a grip attachment and selecting the weight you want to use Grasp the handle with your left hand and face your body at a right angle to the cable pulley with your feet firmly on the floor and shoulder width apart Your forearm should be at a right angle to your upper arm Pull down with your left oblique as far as possible Pause, then lower the weight back down Don't let the weight drop to the stack at any time throughout the exercise Repeat this movement for the desired number of reps and then switch to your other side  ​Exercise ","Keep your back straight and eyes looking forward at all times Keep the arm that's holding the cable fixed at all times Pause for 2+ seconds at the mid point of the exercise for added intensity ",https://cdn.muscleandstrength.com/sites/default/files/styles/400x250/public/field/image/exercise/standingobliquecrunch1.jpg?itok=bZv9jwGz,
Roman Chair Knee Raise,"{""targetMuscleGroup"":""Abs"",""exerciseType"":""Strength"",""equipmentRequired"":""Bodyweight"",""mechanics"":""Compound"",""forceType"":""N/A"",""experienceLevel"":""Beginner"",""secondaryMuscles"":""None ""}",,"The Roman chair knee raise hits your lower abdominal muscles Get into the chair so that your forearms are resting on the pads, back on the back pad, and hands grasping the handles Take your feet off the rests so they are hanging straight down Slowly raise your knees up as high as possible Pause, then lower back to the starting position Repeat for desired reps Knee Raise ","You must do the Roman chair leg raise slowly Using speed and momentum throughout the exercise takes the emphasis off your abs You can also do this exercise weighted, holding a dumbbell between your feet ",https://cdn.muscleandstrength.com/sites/default/files/styles/400x250/public/field/image/exercise/chairkneeraise1.jpg?itok=FnYcbrev,
