운동명,운동 정보,운동 소개,운동 절차,운동 팁,썸네일 링크,유튜브 링크
Hollow Body Hold,"{""targetMuscleGroup"":""Abs"",""exerciseType"":""Strength"",""equipmentRequired"":""Bodyweight"",""mechanics"":""Compound"",""forceType"":""Isometric"",""experienceLevel"":""Intermediate"",""secondaryMuscles"":""None ""}","The hollow body hold is a more advanced variation of the dead bug and an exercise used to strengthen the muscles of the abs.
The hollow body hold stems from the plank exercise family tree and trains the abs utilizing an anti-extension movement which forces the core to stabilize the spine through isometric tension.
","Setup in a supine position with your legs straight, hips flexed, and arms reaching towards the ceiling Slowly lower your legs as you extend your hips and allow your arms to reach overhead But, ensure you only lower them to the point where you can keep your lower back pressed into the floor Hold for the desired length of time Repeat for the desired number of repetitions ","Do not hold your breath, you shouldn’t be using respiration to compensate for a lack of stability  Learn how to move while maintaining position without having to rely upon your breath If you can’t maintain neutral spine despite the positioning of your arms or legs, then look to regress to something like a dead bug or a wall press abs variation You can also regress the movement by bending your knees, hovering your feet just off the floor, and reaching your hands out diagonally towards your feet to help cue more of a “hollow” position  All of these modifications will essentially shorten the lever which you’re trying to overcome while completing the exercise Keep your head off the ground and point your toes Hollow body holds take time to master and should be the foundation for any gymnastics work  Similarly, if you’re struggling to maintain handstands or other bodyweight work, it would be worth improving your hollow body hold ",https://cdn.muscleandstrength.com/sites/default/files/hollow-body-hold.jpg,https://www.youtube.com/embed/lmkw48_CGm0?rel=0
Stir the Pot on Exercise Ball,"{""targetMuscleGroup"":""Abs"",""exerciseType"":""Strength"",""equipmentRequired"":""Exercise Ball"",""mechanics"":""Compound"",""forceType"":""Isometric"",""experienceLevel"":""Beginner"",""secondaryMuscles"":""None ""}","The stir the pot on an exercise ball is variation of the exercise ball plank and an exercise used to target the muscles of the core.
The stir the pot on an exercise ball exercise works the core muscles by challenging the stability of one’s core.
","Assume a kneeling position with your forearms resting on a physioball Extend each leg and utilize a shoulder width (or slightly wider) stance Slowly rotate the arms in a clockwise fashion for the assigned number of repetitions Repeat for the desired number of repetitions in the opposite direction (counter clockwise) ","The movement should occur entirely at the shoulders, ensure the forearms and upper arms maintain (nearly) 90 degrees Do not allow the lower back to arch as the forearms rotate - keep tension through your abdominals and squeeze your glutes Rotate slowly and focus on not allowing the hips to drop to either side Press your elbows into the ball to help engage your serratus anterior as your rotate the forearms Do not hold your breath, you shouldn’t be using respiration to compensate for a lack of stability  Learn how to move while maintaining position without having to rely upon your breath ",https://cdn.muscleandstrength.com/sites/default/files/stir-the-pot-physioball.jpg,https://www.youtube.com/embed/3h8_DwH061Q?rel=0
Plank With Feet On Bench,"{""targetMuscleGroup"":""Abs"",""exerciseType"":""Strength"",""equipmentRequired"":""Bodyweight"",""mechanics"":""Isolation"",""forceType"":""Static"",""experienceLevel"":""Beginner"",""secondaryMuscles"":""Lower Back ""}",,"This is another version of the plank exercise The difference being that your feet are elevated on a bench This makes the exercise slightly more demanding Set up for the exercise by placing a mat on the floor and setting a bench at right angles on one end Put your feet on the bench, and rest your torso on your elbows Straighten out your whole body to form a perfectly straight plank Hold this position as long as possible Rest for 1 min, then repeat Plank ","Keep your body dead straight at all times  Do not let your mid section sag!Add intensity by lifting one of your feet off the bench slightly ",https://cdn.muscleandstrength.com/sites/default/files/styles/400x250/public/field/image/exercise/plankwithfeetonbench1.jpg?itok=yYC9u2wP,
Seated Barbell Twist,"{""targetMuscleGroup"":""Abs"",""exerciseType"":""Strength"",""equipmentRequired"":""Barbell"",""mechanics"":""Isolation"",""forceType"":""N/A"",""experienceLevel"":""Beginner"",""secondaryMuscles"":""None ""}",,"The seated barbell twist exercise focuses on your obliques Grab a light barbell and rest it on the muscle on the back of your neck Do not rest the weight on your neck!Sit down on a flat bench with your feet at a wider than shoulder width stance, firmly on the floor Keep your back firm and straight Slowly twist your torso to the right and then to the left Twist as far as possible Do not move your head with the twist, but keep facing forward ​Exercise ",Keep your head facing forward Don't look from side to side  Keep your abs tight throughout the whole set Make sure you have enough room if you're using an Olympic bar!,https://cdn.muscleandstrength.com/sites/default/files/styles/400x250/public/field/image/exercise/seatedbarbelltwist1.jpg?itok=pbbAQytB,
Frog Sit Up,"{""targetMuscleGroup"":""Abs"",""exerciseType"":""Strength"",""equipmentRequired"":""Bodyweight"",""mechanics"":""Isolation"",""forceType"":""Pull (Bilateral)"",""experienceLevel"":""Beginner"",""secondaryMuscles"":""None ""}","The frog sit up is an exercise used to target the muscles of the core. It is a flexion based exercise and may not be suitable for those with low back pain.
The frog sit up is a variation of the sit up. The main difference in the frog sit up is the foot positioning, which as a result, encourages you to open up your hips more than a standard sit up would.
","Lay supine in a relaxed position with your arms crossed, feet together, legs open, and knees pushed outwards Exhale and squeeze your abs as you raise your upper back off the floor Once your abs are fully contracted, slowly lower yourself back to the starting position and complete for the assigned number of repetitions ","Exhale hard like you’re blowing out candles on a cake and hold the contraction for a second in order to improve mind muscle connection If your lower back bothers you during this exercise, choose more anti extension and anti rotation based movements Avoid putting the hands behind the head as this can lead to excess strain upon the neck ",https://cdn.muscleandstrength.com/sites/default/files/frog-sit-up.jpg,https://www.youtube.com/embed/BFBjfwAkhhY?rel=0
Hip Adduction Machine,"{""targetMuscleGroup"":""Adductors"",""exerciseType"":""Strength"",""equipmentRequired"":""Machine"",""mechanics"":""Isolation"",""forceType"":""Push (Bilateral)"",""experienceLevel"":""Beginner"",""secondaryMuscles"":""Glutes, Hamstrings ""}","The hip adduction machine exercise is an exercise used to strengthen the muscles of the adductors.
Having strong adductor plays a critical role in using maximal weights on lower body exercises such as squats and lunges.
From an aesthetic standpoint, using the hip adduction machine can help in building shapely inner thighs.
","Setup in an upright position with your back against the pad and your spine neutral Exhale and pull the legs together as you squeeze the pads inward Once the pads touch, slowly return to the starting position Repeat for the desired number of repetitions ","Experiment with foot and pelvis position  Depending upon the shape of your hip, you may need a slightly more internal or external starting position to fully maximize the contraction Similarly, be mindful of your pelvic position - don’t allow the back to arch as this will tip the hips forward and place the adductors under excessive stretch before the contraction which can affect force output If you can’t seem to figure out how to change the position of your pelvis while seated, experiment with changing the position of the torso (i e  lean forward or push your back into the pad) ",https://cdn.muscleandstrength.com/sites/default/files/hip-adduction-machine.jpg,https://www.youtube.com/embed/Oj7IN952fSg?rel=0
Deep Squat Prying,"{""targetMuscleGroup"":""Adductors"",""exerciseType"":""Warmup"",""equipmentRequired"":""Kettle Bells"",""mechanics"":""Compound"",""forceType"":""Dynamic Stretching"",""experienceLevel"":""Beginner"",""secondaryMuscles"":""Glutes, Hamstrings, Hip Flexors, Quads ""}","The deep squat prying drill is both an activation exercise and a drill that promotes increased mobility.
The deep squat portion of the drill is beneficial in activating the muscles of the lower body including the adductors, quads, glutes, and hamstrings.
The prying part of the drill helps open up the hips to promote more fluid range of motions during your working sets later in the workout.
One would typically perform the deep squat prying drill at the beginning of their workouts as a dynamic stretch in their specific warm up routine.
","In a standing position with a shoulder width stance, hold a kettlebell at chest height using both hands Squat down by breaking at the hips and knees simultaneously Sit as deep as comfortably possible Rock from side to side while flexing the ankles and pushing the knees out with the elbows to open up the hips Repeat for the desired number of repetitions or time ","Focus on keeping your spine tall in the bottom position and don’t allow the weight to pull your forward Ideally you should be able to sit comfortably in the bottom position and open up the hips and ankles as you rock side to side To get into a deep squat, you should try to focus on sitting down rather than back to keep your torso upright ",https://cdn.muscleandstrength.com/sites/default/files/deep-squat-prying.jpg,https://www.youtube.com/embed/GWhI41W8xnk?rel=0
Rocking Frog Stretch,"{""targetMuscleGroup"":""Adductors"",""exerciseType"":""Warmup"",""equipmentRequired"":""Bodyweight"",""mechanics"":""Compound"",""forceType"":""Dynamic Stretching"",""experienceLevel"":""Beginner"",""secondaryMuscles"":""Shoulders, Upper Back ""}","The rocking frog stretching drill is a form of dynamic stretching that warms up the muscles of the groin, upper back and shoulders.
Dynamic stretching is critical prior to performing your workouts as it allows you to activate your central nervous system and engage the muscle groups you’ll use later in your workout. Incorporating them into your warm up routine will help you get better results and avoid injury.
","In a quadruped position, ensure the hands are underneath the shoulders, the knees are underneath the hips, and the toes are tucked Spread the knees wide until you feel a stretch within your groin From here, push your hands into the ground to drive your hips back and keep your chest upright Push back until your hips run out of range of motion and then return to the starting position Repeat for the desired number of repetitions ","Focus on keeping all of the movement relegated to the hip, don’t allow the spine to move to compensate a lack of hip mobility Push into the floor with your hands and focus on keeping the head neutral If you feel a pinch in the front portion of your hips while you rock back, experiment with different knee widths  Depending upon your individual anatomy, you may need a slightly wider or narrower stance ",https://cdn.muscleandstrength.com/sites/default/files/rocking-frog-stretch.jpg,https://www.youtube.com/embed/ABcuTyDyRhU?rel=0&showinfo=0
Alternating Lateral Lunge with Overhead Reach,"{""targetMuscleGroup"":""Adductors"",""exerciseType"":""Warmup"",""equipmentRequired"":""Bodyweight"",""mechanics"":""Compound"",""forceType"":""Dynamic Stretching"",""experienceLevel"":""Beginner"",""secondaryMuscles"":""Calves, Hamstrings, Shoulders, Upper Back ""}","The alternating lateral lunge with overhead reach is a warm-up exercise used to dynamically stretch the lower body, shoulders, and upper back. The stretch primarily increases mobility in the groin, but will also be felt in the shoulders.
Warming up adequately is an important part of any workout routine, and maintaining mobility can increase the overall effectiveness of certain exercises.
","Stand in an upright position with your feet together and arms at your sides Step laterally and sit back into your hip while you extend your opposite leg Once at the bottom of the lateral lunge, keep your arms straight and raise them into shoulder flexion After you reach overhead, lower the arms and push back to your starting position Repeat for the desired number of repetitions on both sides ","As your raise the arms overhead, make sure the movements comes entirely from the shoulders and not the spine Exhale as you reach and focus on activating the musculature of your upper back and posterior shoulder During the lateral lunge, if you’re able to descend deep into the movement, experiment with allowing the sole of the shoe to come off the floor and point your toes towards the ceiling  Depending upon each individual’s bony hip anatomy, this may feel better ",https://cdn.muscleandstrength.com/sites/default/files/alternating-lateral-lunge-with-overhead-reach.jpg,https://www.youtube.com/embed/cGQ3H4sZbSM?rel=0
Lateral Kneeling Adductor Mobilization,"{""targetMuscleGroup"":""Adductors"",""exerciseType"":""Warmup"",""equipmentRequired"":""Bodyweight"",""mechanics"":""Compound"",""forceType"":""Dynamic Stretching"",""experienceLevel"":""Beginner"",""secondaryMuscles"":""Calves ""}","The lateral kneeling adductor mobilization drill is a form of dynamic stretching and an exercise used to alleviate tension in the adductors.
Ensuring you’re properly warmed up is important for maximizing your time in the gym and avoiding injury.
","In an quadruped position, ensure the toes are tucked and the hands are directly underneath the shoulders Straighten one leg to the side and keep the foot flat on the floor Exhale and push your hands into the floor to direct your hips backwards to increase the stretch on your groin Once you run out of range of motion in your adductor, rock back to the starting position and repeat for the assigned number of repetitions on both sides ","If you feel a pinch on the outside of the hip joint instead of a stretch on the inside portion (i e  the adductor) then you may have adopted a stance is slightly too wide and as such you’re getting a bit of bone on bone contact  Bring your stance in a touch and push back a bit further or switch to more advanced progression such as a cossack squat Focus on keeping your spine neutral by thinking about “making your spine long” as you rock back If you feel your pelvis rolling underneath or spine rounding, then you’ve essentially run out of range of motion at the hip and you’re not compensating with the spine Move slowly and methodically, to be able to use new ranges of motion, you must be able to control them ",https://cdn.muscleandstrength.com/sites/default/files/lateral-kneeling-adductor-mobilization.jpg,https://www.youtube.com/embed/NsZRuAHF7sI?rel=0&showinfo=0
Cable Hip Adduction,"{""targetMuscleGroup"":""Adductors"",""exerciseType"":""Strength"",""equipmentRequired"":""Cable"",""mechanics"":""Isolation"",""forceType"":""N/A"",""experienceLevel"":""Beginner"",""secondaryMuscles"":""Glutes, Hamstrings ""}",,"Set up for the cable hip adduction by attaching an ankle strap (if one is not available, a single handle may suffice) to the low pulley of a cable pulley machine and set your desired weight on the stack Attach the ankle strap to your left ankle and stand up straight with your feet close together with your left foot closest to the machine  You can use your left arm to hold onto the machine for stability You are now in the staring position Begin the movement by lifting your left foot off the floor to take the weight off the rack Keep your leg as straight as possible and begin slowly moving it across your body until your ankle passes your standing leg Pause for a moment and then slowly reverse the movement and bring your leg back to the starting position  Repeat for the desired amount of reps  Turn around, attach the the strap to your right ankle and then repeat with your right leg ​Exercise ","Stand up straight and focus on moving only at the hip Keep your torso as still as possible You can eventually begin to increase the range of motion by standing further and further away from the machine This will require a good deal of balance as you won't be able 